icd_id	icd_name	another_sctid	another_sct_term_cn	another_sct_term	relationship_type	icd_where
B02.3	带状疱疹眼病	38907003	水痘	Chickenpox	After	source
S04.9	未特指的脑神经损伤	36539009	颅神经损伤及其后遗症(疾病)	Disorder due to and following injury of cranial nerve (disorder)	After	destination
T65.9	未特指物质的毒性效应	363304009	中毒的后遗症	Late effect of poisoning	After	destination
S44.9	在肩和上臂水平的未特指神经的损伤	784382001	肩部神经损伤的晚期效应	Late effect of injury of nerve of shoulder	After	destination
T11.3	上肢未特指神经的损伤,水平未特指	784383006	上肢神经损伤及其后遗症	Disorder due to and following injury of nerve of upper limb	After	destination
B94.8	其他特指传染病和寄生虫病的后遗症	38907003	水痘	Chickenpox	After	source
T85.7	其他内部假体装置、植入物和移植物引起的感染和炎症性反应	782902008	植入程序(程序)	Implantation procedure (procedure)	After	source
T84.6	内部固定装置[任何部位]引起的感染和炎症性反应	118470002	应用内固定系统进行内固定	Internal fixation using internal fixator system	After	source
T65.9	未特指物质的毒性效应	218249005	意外中毒后遗症	Sequela of accidental poisoning	After	destination
A09.0	其他和未特指传染性病因的胃肠炎和结肠炎	239785008	痢疾后反应性关节炎	Post-dysenteric reactive arthritis	After	destination
T23.0	腕和手未特指程度的烧伤	210937001	手腕和手部烧伤后遗症	Disorder due to and following burn of wrist and hand	After	destination
T23.0	腕和手未特指程度的烧伤	210937001	手腕和手部烧伤后遗症	Disorder due to and following burn of wrist and hand	After	destination
T22.0	肩和上肢未特指程度的烧伤,除外腕和手	134424008	上肢烧伤引起或继发的失调(失调)	Disorder due to and following burn of upper limb (disorder)	After	destination
T23.0	腕和手未特指程度的烧伤	769230009	手烧伤引起或继发的手部紊乱(紊乱)	Disorder due to and following burn of hand (disorder)	After	destination
B02.3	带状疱疹眼病	38907003	水痘	Chickenpox	After	source
T85.8	内部假体装置、植入物和移植物的其他并发症,不可归类在他处者	782902008	植入程序(程序)	Implantation procedure (procedure)	After	source
G50.8	三叉神经的其他疾患	38907003	水痘	Chickenpox	After	source
B02.3	带状疱疹眼病	38907003	水痘	Chickenpox	After	source
T84.6	内部固定装置[任何部位]引起的感染和炎症性反应	118470002	应用内固定系统进行内固定	Internal fixation using internal fixator system	After	source
T14.9	未特指的损伤	785903005	损伤后肌肉挛缩	Contracture of muscle following injury	After	destination
T85.7	其他内部假体装置、植入物和移植物引起的感染和炎症性反应	782902008	植入程序(程序)	Implantation procedure (procedure)	After	source
T13.3	下肢未特指神经的损伤,水平未特指	784338005	下肢神经损伤所致或继发的功能障碍(功能障碍)	Disorder due to and following injury of nerve of lower limb (disorder)	After	destination
B02.3	带状疱疹眼病	38907003	水痘	Chickenpox	After	source
T30.0	身体未特指部位的烧伤,程度未特指	21835004	烧伤后遗症	Sequela of burn	After	destination
B02.3	带状疱疹眼病	38907003	水痘	Chickenpox	After	source
T11.9	上肢未特指的损伤,水平未特指	285236005	上肢损伤(障碍)所致或继发的功能障碍	Disorder due to and following injury of upper limb (disorder)	After	destination
T14.9	未特指的损伤	785902000	损伤后关节挛缩(障碍)	Contracture of joint following injury (disorder)	After	destination
B02.3	带状疱疹眼病	38907003	水痘	Chickenpox	After	source
T50.9	其他和未特指的药物、药剂和生物制品中毒	784359003	药物中毒后遗症	Sequela of drug poisoning	After	destination
T11.9	上肢未特指的损伤,水平未特指	210960009	上肢肌肉、肌腱损伤后遗症(疾病)	Disorder due to and following injury of muscle and tendon of upper limb (disorder)	After	destination
T13.9	下肢未特指的损伤,水平未特指	210965004	下肢肌腱损伤后遗症	Sequela of injury of muscle and tendon of lower limb	After	destination
B02.9	带状疱疹不伴有并发症	38907003	水痘	Chickenpox	After	source
T14.4	身体未特指部位的神经损伤	111729006	神经损伤(疾病)引起的或随后引起的疾病	Disorder due to and following injury to nerve (disorder)	After	destination
T85.7	其他内部假体装置、植入物和移植物引起的感染和炎症性反应	782902008	植入程序(程序)	Implantation procedure (procedure)	After	source
S05.8	眼和眶其他损伤	787519008	闭合性眼钝器伤(障碍性)	Closed blunt force injury to eye (disorder)	After	source
B00.2	疱疹病毒性龈口炎和咽扁桃体炎	38907003	水痘	Chickenpox	After	source
B02.3	带状疱疹眼病	38907003	水痘	Chickenpox	After	source
T86.0	骨髓移植排斥	23719005	骨髓输注	Transfusion of bone marrow	After	source
T86.0	骨髓移植排斥	23719005	骨髓输注	Transfusion of bone marrow	After	source
T86.0	骨髓移植排斥	23719005	骨髓输注	Transfusion of bone marrow	After	source
T86.0	骨髓移植排斥	23719005	骨髓输注	Transfusion of bone marrow	After	source
T30.0	身体未特指部位的烧伤,程度未特指	432513009	烧伤后遗症引起的畸形	Deformity as a sequela of burn	After	destination
B02.3	带状疱疹眼病	38907003	水痘	Chickenpox	After	source
E23.0	垂体功能减退症	23719005	骨髓输注	Transfusion of bone marrow	After	source
Z94.5	皮肤移植状态	19835001	同种异体皮肤移植(手术)	Allograft of skin to skin (procedure)	After	source
T86.0	骨髓移植排斥	23719005	骨髓输注	Transfusion of bone marrow	After	source
D47.9	淋巴、造血和有关组织未特指的动态未定或动态未知的肿瘤	23719005	骨髓输注	Transfusion of bone marrow	After	source
B02.9	带状疱疹不伴有并发症	38907003	水痘	Chickenpox	After	source
B02.3	带状疱疹眼病	38907003	水痘	Chickenpox	After	source
B02.8	带状疱疹伴有其他并发症	38907003	水痘	Chickenpox	After	source
B02.3	带状疱疹眼病	38907003	水痘	Chickenpox	After	source
Z94.8	其他器官和组织的移植状态	23719005	骨髓输注	Transfusion of bone marrow	After	source
B02.8	带状疱疹伴有其他并发症	38907003	水痘	Chickenpox	After	source
T86.0	骨髓移植排斥	23719005	骨髓输注	Transfusion of bone marrow	After	source
T86.0	骨髓移植排斥	23719005	骨髓输注	Transfusion of bone marrow	After	source
B30.9	未特指的病毒性结膜炎	38907003	水痘	Chickenpox	After	source
B02.9	带状疱疹不伴有并发症	38907003	水痘	Chickenpox	After	source
B02.3	带状疱疹眼病	38907003	水痘	Chickenpox	After	source
B02.3	带状疱疹眼病	38907003	水痘	Chickenpox	After	source
B30.9	未特指的病毒性结膜炎	38907003	水痘	Chickenpox	After	source
T23.0	腕和手未特指程度的烧伤	769228007	腕部烧伤引起或继发的疾病	Disorder due to and following burn of wrist (disorder)	After	destination
T86.0	骨髓移植排斥	23719005	骨髓输注	Transfusion of bone marrow	After	source
B02.3	带状疱疹眼病	38907003	水痘	Chickenpox	After	source
B02.3	带状疱疹眼病	38907003	水痘	Chickenpox	After	source
B02.3	带状疱疹眼病	38907003	水痘	Chickenpox	After	source
B02.3	带状疱疹眼病	38907003	水痘	Chickenpox	After	source
B02.8	带状疱疹伴有其他并发症	38907003	水痘	Chickenpox	After	source
B02.3	带状疱疹眼病	38907003	水痘	Chickenpox	After	source
D75.9	血液和造血器官未特指的疾病	23719005	骨髓输注	Transfusion of bone marrow	After	source
B02.3	带状疱疹眼病	38907003	水痘	Chickenpox	After	source
S01.9	头部部位未特指的开放性伤口	209956005	头部开放性创伤后硬膜下出血(紊乱)	Subdural hemorrhage following open wound of head (disorder)	After	destination
B02.8	带状疱疹伴有其他并发症	38907003	水痘	Chickenpox	After	source
B02.3	带状疱疹眼病	38907003	水痘	Chickenpox	After	source
H26.1	外伤性白内障	784306000	晶状体囊破裂	Rupture of lens capsule	After	source
T14.1	身体未特指部位的开放性伤口	286613000	伤后瘢痕(紊乱)	Scar following wound (disorder)	After	destination
Y88.0	"在治疗中使用药物、药剂和生物制品引起有害效应的后遗症	"	275385007	生物性物质中毒	Poisoning caused by biological substance	After	source
H43.8	玻璃体的其他疾患	16615741000119105	玻璃体后脱离病史(情况)	History of posterior vitreous detachment (situation)	Associated finding	destination
S05.9	眼和眶未特指的损伤	16535651000119101	眼部损伤史(情况)	History of injury of eye region (situation)	Associated finding	destination
B02.3	带状疱疹眼病	16540531000119103	眼带状疱疹病史	History of ocular zoster	Associated finding	destination
I63.4	大脑动脉栓塞引起的脑梗死	16896851000119101	栓塞性中风的病史(情况)	History of embolic cerebrovascular accident (situation)	Associated finding	destination
K62.5	肛门和直肠出血	16885661000119108	直肠出血史	History of rectal haemorrhage	Associated finding	destination
H53.0	失用性弱视	16697921000119109	怀疑双眼弱视(情况)	Suspected amblyopia of bilateral eyes (situation)	Associated finding	destination
M30.3	粘膜皮肤淋巴结综合征[川崎病]	16360861000119103	急性发热性川崎氏病病史(情况)	History of acute febrile mucocutaneous lymph node syndrome (situation)	Associated finding	destination
H50.9	未特指的斜视	16535691000119106	斜视史(情况)	History of strabismus (situation)	Associated finding	destination
D06.9	宫颈未特指的原位癌	10738811000119103	子宫颈原位癌病史(情况)	History of carcinoma in situ of uterine cervix (situation)	Associated finding	destination
D69.6	未特指的血小板减少	49341000119108	低血小板计数的历史	History of thrombocytopenia	Associated finding	destination
G93.1	缺氧性脑损害,不可归类在他处者	16542721000119108	缺氧性脑损伤病史(情况)	History of anoxic brain injury (situation)	Associated finding	destination
Z91.8	其他特指危险因素个人史,不可归类在他处者	787209003	家庭虐待成年人(事件)	Domestic physical abuse of adult (event)	Associated finding	source
I67.1	脑动脉瘤,未破裂	16845421000119109	脑内的动脉瘤的历史	History of cerebral aneurysm	Associated finding	destination
I62.9	未特指的颅内出血(非创伤性)	16864911000119103	颅内出血的历史	History of intracranial hemorrhage	Associated finding	destination
Z87.3	肌肉骨骼系统和结缔组织疾病个人史	787206005	他汀类药物引起的横纹肌溶解症	Rhabdomyolysis due to statin (disorder)	Associated finding	source
Q79.3	腹裂	16279601000119105	腹裂史(情况)	History of gastroschisis (situation)	Associated finding	destination
Z86.0	其他肿瘤个人史	15641141000119100	十二指肠绒毛状腺瘤	Villous adenoma of duodenum	Associated finding	source
I74.9	未特指动脉的栓塞和血栓形成	16833281000119106	动脉血栓形成病史	History of arterial thrombosis	Associated finding	destination
H35.3	黄斑和后极变性	16535401000119102	老年黄斑变性的历史	History of macular degeneration	Associated finding	destination
Z84.8	其他特指情况家族史	267340006	产时母体发热	Maternal pyrexia during labour	Associated finding	source
F05.9	未特指的谵妄	16535771000119101	精神错乱病史	History of delirium	Associated finding	destination
Z86.0	其他肿瘤个人史	189948006	神经鞘瘤	Neurilemmoma	Associated finding	source
H02.4	上睑下垂	16880931000119102	眼睑下垂病史	History of eyelid ptosis	Associated finding	destination
H21.0	前房积血	15627801000119104	前房积血病史(情况)	History of hyphema (situation)	Associated finding	destination
N05.9	"未特指的肾炎综合征,未特指	"	1081901000112109	怀疑肾小球肾炎(情况)	Glomerulonephritis suspected (situation)	Associated finding	destination
H16.0	角膜溃疡	15647891000119108	角膜糜烂史(情况)	History of corneal erosion (situation)	Associated finding	destination
H35.8	视网膜其他特指的疾患	13016311000119104	视网膜水肿病史	History of retinal oedema	Associated finding	destination
H47.0	视神经疾患,不可归类在他处者	16093711000119100	前部缺血性视神经病变史	History of anterior ischaemic optic neuropathy	Associated finding	destination
Z86.6	神经系统和感觉器官疾病个人史	28998008	视网膜出血(障碍)	Retinal hemorrhage (disorder)	Associated finding	source
H15.1	巩膜外层炎	15912951000119101	外侧巩膜炎病史(情况)	History of episcleritis (situation)	Associated finding	destination
H53.0	失用性弱视	16698001000119102	怀疑右眼弱视	Suspected amblyopia of right eye (situation)	Associated finding	destination
T14.0	身体未特指部位的浅表损伤	787774005	怀疑表浅异物(情况)	Suspected superficial foreign body (situation)	Associated finding	destination
T18.9	消化道未特指部位内异物	787772009	怀疑吞食异物	Suspected swallowed foreign body	Associated finding	destination
T17.9	呼吸道未特指部位内异物	787773004	唿吸道怀疑有异物(情况)	Suspected foreign body in respiratory tract (situation)	Associated finding	destination
O35.0	"为胎儿(可疑)中枢神经系统畸形给予的孕产妇医疗	"	783726006	胎儿脑积水	Foetal hydrocephalus	Associated finding	source
O35.0	"为胎儿(可疑)中枢神经系统畸形给予的孕产妇医疗	"	783724009	胎儿脊柱裂(疾病)	Fetal spina bifida (disorder)	Associated finding	source
H35.5	遗传性视网膜变性	16535611000119102	视网膜色素变性的历史	History of retinitis pigmentosa	Associated finding	destination
D17.9	未特指的良性脂肪瘤样肿瘤	16900351000119101	脂肪瘤病史(情况)	History of lipoma (situation)	Associated finding	destination
A92.8	其他特指的蚊媒介的病毒性发热	16468501000119108	兹卡热的历史(情况)	History of Zika virus infection (situation)	Associated finding	destination
K62.6	肛门和直肠溃疡	16089171000119106	直肠溃疡病史	History of ulcer of rectum	Associated finding	destination
I63.9	未特指的脑梗死	16896891000119106	缺血性中风病史	History of cerebrovascular accident due to ischemia (situation)	Associated finding	destination
H53.0	失用性弱视	16697921000119109	怀疑双眼弱视(情况)	Suspected amblyopia of bilateral eyes (situation)	Associated finding	destination
K22.2	食管梗阻	16915451000119104	食管狭窄病史	History of stricture of oesophagus	Associated finding	destination
K70.1	酒精性肝炎	16912131000119107	酒精性肝炎的历史	History of alcoholic hepatitis	Associated finding	destination
H35.1	早产儿视网膜病	16519911000119101	早产儿视网膜病史(情况)	History of retinopathy of prematurity (situation)	Associated finding	destination
K28.9	胃空肠溃疡未特指为急性或慢性,不伴有出血或穿孔	16089211000119108	胃空肠溃疡病史(情况)	History of gastrojejunal ulcer (situation)	Associated finding	destination
J38.5	喉痉挛	16410191000119105	喉痉挛史	History of laryngospasm	Associated finding	destination
H34.2	其他视网膜动脉阻塞	16279641000119107	视网膜分支动脉阻塞病史(情况)	History of occlusion of branch retinal artery (situation)	Associated finding	destination
Z82.6	关节炎和肌肉骨骼系统和结缔组织其他疾病家族史	240008008	腘窝滑膜囊肿	Synovial cyst of popliteal space	Associated finding	source
R40.2	未特指的昏迷	16775181000119103	昏迷史(情况)	History of coma (situation)	Associated finding	destination
H53.0	失用性弱视	16697961000119104	怀疑左眼弱视	Suspected amblyopia of left eye (situation)	Associated finding	destination
S61.0	手指开放性伤口不伴有指甲损害	783710005	浅表撕裂伤	Superficial laceration	Associated morphology	source
D33.3	脑神经良性肿瘤	253086004	细胞性神经鞘瘤	Cellular neurilemmoma	Associated morphology	source
Q20.8	心腔和心连接其他的先天性畸形	783804002	不正常的交流	Abnormal communication	Associated morphology	source
Q20.8	心腔和心连接其他的先天性畸形	783804002	不正常的交流	Abnormal communication	Associated morphology	source
Q20.8	心腔和心连接其他的先天性畸形	783804002	不正常的交流	Abnormal communication	Associated morphology	source
Q20.8	心腔和心连接其他的先天性畸形	783804002	不正常的交流	Abnormal communication	Associated morphology	source
Q20.0	共同动脉干	783804002	不正常的交流	Abnormal communication	Associated morphology	source
Q20.5	房室连接不协调	783804002	不正常的交流	Abnormal communication	Associated morphology	source
L72.2	多发性皮脂腺囊肿	784048001	脂肪细胞瘤(形态学异常)	Steatocystomas (morphologic abnormality)	Associated morphology	source
L91.8	皮肤其他的肥厚性疾患	786907004	多发性纤维上皮息肉(形态异常)	Multiple fibroepithelial polyps (morphologic abnormality)	Associated morphology	source
S05.9	眼和眶未特指的损伤	787518000	闭合性钝器伤	Closed blunt force injury	Associated morphology	source
L57.0	光线性角化病	786035003	多发性光化性角化病	Multiple actinic keratoses	Associated morphology	source
D36.1	周围神经和自主神经系统良性肿瘤	985004	神经鞘瘤(形态学异常)	Schwannoma (morphologic abnormality)	Associated morphology	source
Q20.8	心腔和心连接其他的先天性畸形	783804002	不正常的交流	Abnormal communication	Associated morphology	source
Q20.0	共同动脉干	783804002	不正常的交流	Abnormal communication	Associated morphology	source
D22.9	未特指的黑素细胞痣	787085004	棘突溶解性表皮痣(形态异常)	Acantholytic epidermal nevus (morphologic abnormality)	Associated morphology	source
Q20.0	共同动脉干	783804002	不正常的交流	Abnormal communication	Associated morphology	source
Q20.3	心室动脉连接不协调	783804002	不正常的交流	Abnormal communication	Associated morphology	source
Q20.8	心腔和心连接其他的先天性畸形	783804002	不正常的交流	Abnormal communication	Associated morphology	source
Q20.8	心腔和心连接其他的先天性畸形	783804002	不正常的交流	Abnormal communication	Associated morphology	source
Q20.3	心室动脉连接不协调	783804002	不正常的交流	Abnormal communication	Associated morphology	source
D36.1	周围神经和自主神经系统良性肿瘤	985004	神经鞘瘤(形态学异常)	Schwannoma (morphologic abnormality)	Associated morphology	source
Q20.8	心腔和心连接其他的先天性畸形	783804002	不正常的交流	Abnormal communication	Associated morphology	source
Q20.5	房室连接不协调	783804002	不正常的交流	Abnormal communication	Associated morphology	source
Q20.8	心腔和心连接其他的先天性畸形	783804002	不正常的交流	Abnormal communication	Associated morphology	source
Q24.9	未特指的先天性心脏畸形	783804002	不正常的交流	Abnormal communication	Associated morphology	source
Q20.8	心腔和心连接其他的先天性畸形	783804002	不正常的交流	Abnormal communication	Associated morphology	source
Q20.8	心腔和心连接其他的先天性畸形	783804002	不正常的交流	Abnormal communication	Associated morphology	source
Q24.8	心脏其他特指的先天性畸形	783804002	不正常的交流	Abnormal communication	Associated morphology	source
D36.1	周围神经和自主神经系统良性肿瘤	985004	神经鞘瘤(形态学异常)	Schwannoma (morphologic abnormality)	Associated morphology	source
Q20.5	房室连接不协调	783804002	不正常的交流	Abnormal communication	Associated morphology	source
Q20.0	共同动脉干	783804002	不正常的交流	Abnormal communication	Associated morphology	source
H44.7	眼内残留(陈旧性)非磁性异物	786984008	残留的非磁性异物	Retained nonmagnetic foreign body	Associated morphology	source
Q18.2	其他的鳃裂畸形	785762005	鳃囊肿	Branchial cyst	Associated morphology	source
Q20.3	心室动脉连接不协调	783804002	不正常的交流	Abnormal communication	Associated morphology	source
D36.1	周围神经和自主神经系统良性肿瘤	985004	神经鞘瘤(形态学异常)	Schwannoma (morphologic abnormality)	Associated morphology	source
H44.7	眼内残留(陈旧性)非磁性异物	786984008	残留的非磁性异物	Retained nonmagnetic foreign body	Associated morphology	source
S91.0	踝开放性伤口	783710005	浅表撕裂伤	Superficial laceration	Associated morphology	source
Q20.8	心腔和心连接其他的先天性畸形	783804002	不正常的交流	Abnormal communication	Associated morphology	source
Q20.8	心腔和心连接其他的先天性畸形	783804002	不正常的交流	Abnormal communication	Associated morphology	source
Q20.3	心室动脉连接不协调	783804002	不正常的交流	Abnormal communication	Associated morphology	source
Q21.0	室间隔缺损	783804002	不正常的交流	Abnormal communication	Associated morphology	source
O70.0	"分娩时Ⅰ度会阴裂伤	"	783727002	一度撕裂(形态学异常)	First degree laceration (morphologic abnormality)	Associated morphology	source
Q85.0	神经纤维瘤病(非恶性)	985004	神经鞘瘤(形态学异常)	Schwannoma (morphologic abnormality)	Associated morphology	source
T14.1	身体未特指部位的开放性伤口	784358006	深深的刺伤	Deep stab wound	Associated morphology	source
Q20.1	右心室双出口	783804002	不正常的交流	Abnormal communication	Associated morphology	source
Q20.0	共同动脉干	783804002	不正常的交流	Abnormal communication	Associated morphology	source
S80.9	小腿未特指的浅表损伤	783710005	浅表撕裂伤	Superficial laceration	Associated morphology	source
T11.1	上肢开放性伤口,水平未特指	783710005	浅表撕裂伤	Superficial laceration	Associated morphology	source
T14.0	身体未特指部位的浅表损伤	785852005	深度挫伤	Deep contusion	Associated morphology	source
Q32.4	支气管的其他先天性畸形	783804002	不正常的交流	Abnormal communication	Associated morphology	source
S01.9	头部部位未特指的开放性伤口	783710005	浅表撕裂伤	Superficial laceration	Associated morphology	source
G93.0	大脑囊肿	785284009	蛛网膜囊肿	Arachnoid cyst	Associated morphology	source
Q20.1	右心室双出口	783804002	不正常的交流	Abnormal communication	Associated morphology	source
Q20.3	心室动脉连接不协调	783804002	不正常的交流	Abnormal communication	Associated morphology	source
Q20.5	房室连接不协调	783804002	不正常的交流	Abnormal communication	Associated morphology	source
L57.0	光线性角化病	786035003	多发性光化性角化病	Multiple actinic keratoses	Associated morphology	source
H44.7	眼内残留(陈旧性)非磁性异物	786984008	残留的非磁性异物	Retained nonmagnetic foreign body	Associated morphology	source
T14.1	身体未特指部位的开放性伤口	784357001	深裂伤(形态学异常)	Deep laceration (morphologic abnormality)	Associated morphology	source
L40.8	其他的银屑病	787087007	炎性表皮痣	Inflammatory epidermal nevus	Associated morphology	source
Q20.5	房室连接不协调	783804002	不正常的交流	Abnormal communication	Associated morphology	source
Q20.4	双入口心室	783804002	不正常的交流	Abnormal communication	Associated morphology	source
D36.1	周围神经和自主神经系统良性肿瘤	985004	神经鞘瘤(形态学异常)	Schwannoma (morphologic abnormality)	Associated morphology	source
S01.8	头部其他部位的开放性伤口	783710005	浅表撕裂伤	Superficial laceration	Associated morphology	source
L57.0	光线性角化病	786035003	多发性光化性角化病	Multiple actinic keratoses	Associated morphology	source
S05.0	结合膜损伤和角膜擦伤,未提及异物	783710005	浅表撕裂伤	Superficial laceration	Associated morphology	source
L91.8	皮肤其他的肥厚性疾患	786907004	多发性纤维上皮息肉(形态异常)	Multiple fibroepithelial polyps (morphologic abnormality)	Associated morphology	source
T13.0	下肢浅表损伤,水平未特指	783710005	浅表撕裂伤	Superficial laceration	Associated morphology	source
T14.1	身体未特指部位的开放性伤口	783710005	浅表撕裂伤	Superficial laceration	Associated morphology	source
Q04.6	先天性大脑囊肿	785284009	蛛网膜囊肿	Arachnoid cyst	Associated morphology	source
Q21.4	主动脉肺动脉间隔缺损	783804002	不正常的交流	Abnormal communication	Associated morphology	source
L91.8	皮肤其他的肥厚性疾患	786907004	多发性纤维上皮息肉(形态异常)	Multiple fibroepithelial polyps (morphologic abnormality)	Associated morphology	source
D22.9	未特指的黑素细胞痣	787085004	棘突溶解性表皮痣(形态异常)	Acantholytic epidermal nevus (morphologic abnormality)	Associated morphology	source
S61.0	手指开放性伤口不伴有指甲损害	783710005	浅表撕裂伤	Superficial laceration	Associated morphology	source
S71.0	髋开放性伤口	783710005	浅表撕裂伤	Superficial laceration	Associated morphology	source
T14.1	身体未特指部位的开放性伤口	783710005	浅表撕裂伤	Superficial laceration	Associated morphology	source
S91.3	足的其他部位的开放性伤口	783710005	浅表撕裂伤	Superficial laceration	Associated morphology	source
S21.2	胸后壁开放性伤口	783710005	浅表撕裂伤	Superficial laceration	Associated morphology	source
